{
  "schemaVersion": 1,
  "generatedUtc": "2026-08-07T04:58:39.460128+00:00",
  "sourceIdentity": {
    "manifestRelativePath": "Recovery/Manifests/source-identity.json",
    "sha256": "d33671f963b2ebaa2b92d47e35296ac3d953af3a10b8b93b0165b91836ee43a8"
  },
  "entries": [
    {
      "category": "lobby-background",
      "purpose": "lobby-background",
      "evidenceStatus": "confirmed",
      "sourceRelativePath": "03_extracted_resources/02_raw_data/Assets/02.resources/addressableresources/rawsprites/lobbystyle/Lobby_10001_1.png",
      "sourceBytes": 3857114,
      "sourceSha256": "f634b5658b0dcac7caceddfb0ddf57b4e71e17a9d08e31bd6ce291f94eae08d2",
      "supportingSources": [],
      "transformation": "byte-for-byte-copy",
      "parameters": {
        "pivot": {
          "m_X": 0.5,
          "m_Y": 0.5
        },
        "pixelsPerUnit": 100
      },
      "evidence": "Selected raw lobby style image; output bytes must match the source exactly.",
      "outputRelativePath": "Assets/Game/Content/UI/Lobby/Background/Lobby_Default.png",
      "outputBytes": 3857114,
      "outputSha256": "f634b5658b0dcac7caceddfb0ddf57b4e71e17a9d08e31bd6ce291f94eae08d2",
      "notes": "Unity runtime resource; ready for Recovery Harness integration."
    },
    {
      "category": "lobby-background",
      "purpose": "lobby-background",
      "evidenceStatus": "confirmed",
      "sourceRelativePath": "03_extracted_resources/02_raw_data/Assets/02.resources/addressableresources/rawsprites/lobbystyle/Lobby_10001_1.png",
      "sourceBytes": 3857114,
      "sourceSha256": "f634b5658b0dcac7caceddfb0ddf57b4e71e17a9d08e31bd6ce291f94eae08d2",
      "supportingSources": [],
      "transformation": "deterministic-unity-textureimporter-meta",
      "parameters": {
        "pivot": {
          "m_X": 0.5,
          "m_Y": 0.5
        },
        "pixelsPerUnit": 100
      },
      "evidence": "Selected raw lobby style image; output bytes must match the source exactly.",
      "outputRelativePath": "Assets/Game/Content/UI/Lobby/Background/Lobby_Default.png.meta",
      "outputBytes": 1293,
      "outputSha256": "32cb8f789fb4abae35e5419bced9282dba5423f611622a3db54009ad0e1fe9ff",
      "notes": "Deterministic GUID and sprite import settings generated by this script."
    },
    {
      "category": "lobby-ui",
      "purpose": "top-currency-elif",
      "evidenceStatus": "inferred",
      "sourceRelativePath": "03_extracted_resources/02_raw_data/Assets/Texture2D/sactx-0-2048x2048-ASTC 6x6-CurrencyIcons-93c0ee5d.png",
      "sourceBytes": 4031167,
      "sourceSha256": "72e9e97c5e466c00f04d3f50469d2278f996e2ed51c230878a7e97241119179e",
      "supportingSources": [
        {
          "role": "sprite-serialization",
          "relativePath": "03_extracted_resources/02_raw_data/Assets/02.resources/99.common/sprites/currencyicons/CurrencyIcon_0009.json",
          "bytes": 5706,
          "sha256": "43acd99509df35ab4ce57f25f31880c92a760ecbf030b0c48c5e9b9f20836316"
        },
        {
          "role": "sprite-atlas-serialization",
          "relativePath": "03_extracted_resources/02_raw_data/Assets/02.resources/addressableresources/atlases/CurrencyIcons.json",
          "bytes": 226403,
          "sha256": "b7c0470d66582dce4533238249143c504683b48ef2c153192a49c0be092c311a"
        }
      ],
      "transformation": "crop-spriteatlas-page",
      "parameters": {
        "atlasTag": "CurrencyIcons",
        "rect": {
          "x": 1315,
          "y": 1577,
          "width": 128,
          "height": 128
        },
        "coordinateConvention": "Unity bottom-left converted to PNG top-left",
        "pivot": {
          "m_X": 0.5,
          "m_Y": 0.5
        },
        "pixelsPerUnit": 50
      },
      "evidence": "Serialized Sprite m_RenderDataKey matched the selected SpriteAtlas render map.",
      "outputRelativePath": "Assets/Game/Content/UI/Lobby/Sprites/Currency_Elif.png",
      "outputBytes": 18876,
      "outputSha256": "d07816805be85e76570476384760c88f77805b9a9decca6fb4fd4b03120bb9a3",
      "notes": "Unity runtime resource; ready for Recovery Harness integration."
    },
    {
      "category": "lobby-ui",
      "purpose": "top-currency-elif",
      "evidenceStatus": "inferred",
      "sourceRelativePath": "03_extracted_resources/02_raw_data/Assets/Texture2D/sactx-0-2048x2048-ASTC 6x6-CurrencyIcons-93c0ee5d.png",
      "sourceBytes": 4031167,
      "sourceSha256": "72e9e97c5e466c00f04d3f50469d2278f996e2ed51c230878a7e97241119179e",
      "supportingSources": [
        {
          "role": "sprite-serialization",
          "relativePath": "03_extracted_resources/02_raw_data/Assets/02.resources/99.common/sprites/currencyicons/CurrencyIcon_0009.json",
          "bytes": 5706,
          "sha256": "43acd99509df35ab4ce57f25f31880c92a760ecbf030b0c48c5e9b9f20836316"
        },
        {
          "role": "sprite-atlas-serialization",
          "relativePath": "03_extracted_resources/02_raw_data/Assets/02.resources/addressableresources/atlases/CurrencyIcons.json",
          "bytes": 226403,
          "sha256": "b7c0470d66582dce4533238249143c504683b48ef2c153192a49c0be092c311a"
        }
      ],
      "transformation": "deterministic-unity-textureimporter-meta",
      "parameters": {
        "atlasTag": "CurrencyIcons",
        "rect": {
          "x": 1315,
          "y": 1577,
          "width": 128,
          "height": 128
        },
        "coordinateConvention": "Unity bottom-left converted to PNG top-left",
        "pivot": {
          "m_X": 0.5,
          "m_Y": 0.5
        },
        "pixelsPerUnit": 50
      },
      "evidence": "Serialized Sprite m_RenderDataKey matched the selected SpriteAtlas render map.",
      "outputRelativePath": "Assets/Game/Content/UI/Lobby/Sprites/Currency_Elif.png.meta",
      "outputBytes": 1292,
      "outputSha256": "896dc0091fbedcfd1db1c8034fb3cb7109a5bf50545637a32d2774a8db32cfea",
      "notes": "Deterministic GUID and sprite import settings generated by this script."
    },
    {
      "category": "lobby-ui",
      "purpose": "top-currency-gold",
      "evidenceStatus": "confirmed",
      "sourceRelativePath": "03_extracted_resources/02_raw_data/Assets/Texture2D/sactx-0-2048x2048-ASTC 6x6-CurrencyIcons-93c0ee5d.png",
      "sourceBytes": 4031167,
      "sourceSha256": "72e9e97c5e466c00f04d3f50469d2278f996e2ed51c230878a7e97241119179e",
      "supportingSources": [
        {
          "role": "sprite-serialization",
          "relativePath": "03_extracted_resources/02_raw_data/Assets/02.resources/99.common/sprites/currencyicons/CurrencyIcon_0008.json",
          "bytes": 5766,
          "sha256": "599056953893b82b36cc334a339a7eea5666635bc3fe308a1b1f3ed5e40dd086"
        },
        {
          "role": "sprite-atlas-serialization",
          "relativePath": "03_extracted_resources/02_raw_data/Assets/02.resources/addressableresources/atlases/CurrencyIcons.json",
          "bytes": 226403,
          "sha256": "b7c0470d66582dce4533238249143c504683b48ef2c153192a49c0be092c311a"
        }
      ],
      "transformation": "crop-spriteatlas-page",
      "parameters": {
        "atlasTag": "CurrencyIcons",
        "rect": {
          "x": 790,
          "y": 918,
          "width": 128,
          "height": 128
        },
        "coordinateConvention": "Unity bottom-left converted to PNG top-left",
        "pivot": {
          "m_X": 0.5,
          "m_Y": 0.5
        },
        "pixelsPerUnit": 50
      },
      "evidence": "Serialized Sprite m_RenderDataKey matched the selected SpriteAtlas render map.",
      "outputRelativePath": "Assets/Game/Content/UI/Lobby/Sprites/Currency_Gold.png",
      "outputBytes": 15115,
      "outputSha256": "91a8fbdd0944093ca45279ef5f7f2b2fa881f709c98b31c657ac889372dd9309",
      "notes": "Unity runtime resource; ready for Recovery Harness integration."
    },
    {
      "category": "lobby-ui",
      "purpose": "top-currency-gold",
      "evidenceStatus": "confirmed",
      "sourceRelativePath": "03_extracted_resources/02_raw_data/Assets/Texture2D/sactx-0-2048x2048-ASTC 6x6-CurrencyIcons-93c0ee5d.png",
      "sourceBytes": 4031167,
      "sourceSha256": "72e9e97c5e466c00f04d3f50469d2278f996e2ed51c230878a7e97241119179e",
      "supportingSources": [
        {
          "role": "sprite-serialization",
          "relativePath": "03_extracted_resources/02_raw_data/Assets/02.resources/99.common/sprites/currencyicons/CurrencyIcon_0008.json",
          "bytes": 5766,
          "sha256": "599056953893b82b36cc334a339a7eea5666635bc3fe308a1b1f3ed5e40dd086"
        },
        {
          "role": "sprite-atlas-serialization",
          "relativePath": "03_extracted_resources/02_raw_data/Assets/02.resources/addressableresources/atlases/CurrencyIcons.json",
          "bytes": 226403,
          "sha256": "b7c0470d66582dce4533238249143c504683b48ef2c153192a49c0be092c311a"
        }
      ],
      "transformation": "deterministic-unity-textureimporter-meta",
      "parameters": {
        "atlasTag": "CurrencyIcons",
        "rect": {
          "x": 790,
          "y": 918,
          "width": 128,
          "height": 128
        },
        "coordinateConvention": "Unity bottom-left converted to PNG top-left",
        "pivot": {
          "m_X": 0.5,
          "m_Y": 0.5
        },
        "pixelsPerUnit": 50
      },
      "evidence": "Serialized Sprite m_RenderDataKey matched the selected SpriteAtlas render map.",
      "outputRelativePath": "Assets/Game/Content/UI/Lobby/Sprites/Currency_Gold.png.meta",
      "outputBytes": 1292,
      "outputSha256": "1ca8d6349772e7c42ed7aab1e8ddf8f040aff2c88fcf1f887804d548ce7ea510",
      "notes": "Deterministic GUID and sprite import settings generated by this script."
    },
    {
      "category": "lobby-ui",
      "purpose": "top-currency-macaron",
      "evidenceStatus": "confirmed",
      "sourceRelativePath": "03_extracted_resources/02_raw_data/Assets/Texture2D/sactx-0-2048x2048-ASTC 6x6-CurrencyIcons-93c0ee5d.png",
      "sourceBytes": 4031167,